{
  "config_version": "2.0.0",
  "source": "url",
  "catalog_ref": null,
  "state": {
    "version": "13.3.0",
    "installed_date": "2025-12-27T15:27:03.670334",
    "installed_path": "/home/developer/Applications/flameshot.AppImage",
    "verification": {
      "passed": true,
      "methods": [
        {
          "type": "digest",
          "status": "passed",
          "algorithm": "SHA256",
          "expected": "sha256:8bb380584b69bab28398e7c33ddd4e285dff7c0816c64918c9427762ce6735df",
          "computed": "8bb380584b69bab28398e7c33ddd4e285dff7c0816c64918c9427762ce6735df",
          "source": "github_api"
        }
      ]
    },
    "icon": {
      "installed": true,
      "method": "extraction",
      "path": "/home/developer/Applications/icons/flameshot.png"
    }
  },
  "overrides": {
    "metadata": {
      "name": "flameshot",
      "display_name": "flameshot",
      "description": ""
    },
    "source": {
      "type": "github",
      "owner": "flameshot-org",
      "repo": "flameshot",
      "prerelease": false
    },
    "appimage": {
      "naming": {
        "template": "",
        "target_name": "flameshot",
        "architectures": [
          "amd64",
          "x86_64"
        ]
      }
    },
    "verification": {
      "method": "digest"
    },
    "icon": {
      "method": "extraction",
      "filename": "flameshot.png"
    }
  }
}