{
  "config_version": "2.0.0",
  "source": "catalog",
  "catalog_ref": "weektodo",
  "state": {
    "version": "2.2.0",
    "installed_date": "2025-08-29T14:53:15.890192",
    "installed_path": "",
    "verification": {
      "passed": false,
      "methods": [
        {
          "type": "skip",
          "status": "skipped"
        }
      ]
    },
    "icon": {
      "installed": true,
      "method": "extraction",
      "path": "/home/developer/Applications/icons/weektodo.png"
    }
  }
}
