{
  "catalog_ref": "weektodo",
  "config_version": "2.0.0",
  "source": "catalog",
  "state": {
    "icon": {
      "installed": true,
      "method": "extraction",
      "path": "/home/developer/Applications/icons/weektodo.png"
    },
    "installed_date": "2025-08-29T14:53:15.890192",
    "installed_path": "",
    "verification": {
      "methods": [
        {
          "status": "skipped",
          "type": "skip"
        }
      ],
      "passed": false
    },
    "version": "2.2.0"
  }
}
